No.,Name,Location,Hectares,bandNumber,bandName,address
6922,NETTLE ISLAND 5,"BARCLAY DISTRICT NETTE ISLAND, LOT 242, AT SOUTHEAST END OF ISLAND ADJOINING CLEHO I.R. NO. 6, IN BARKLEY SOUND",9.8,664,Hupacasath First Nation,"PO BOX 211, PORT ALBERNI, BC, V9Y 7M7"
6926,AHMITSA 5,"SEDDALL ISLAND, CLAYOQUOT DISTRICT, ON SOUTH SHORE OF ISLAND, AT MOUTH OF RAINY BAY, BARKLEY SOUND",10.5,665,Tseshaht,"5091 TSUMA-AS DR, PORT ALBERNI, BC, V9Y 8X9"
6924,ALBERNI 2,"VANCOUVER ISLAND, ALBERNI DISTRICT, ON EAST SHORE OF ALBERNI INLET, AT POLLY POINT, 2 MILES SOUTH OF PORT ALBERNI",63.1,665,Tseshaht,"5091 TSUMA-AS DR, PORT ALBERNI, BC, V9Y 8X9"
6927,CLEHO 6,"NETTLE ISLAND, BARCLAY DISTRICT, ON EAST POINT OF ISLAND IN BARCLAY SOUND",5.3,665,Tseshaht,"5091 TSUMA-AS DR, PORT ALBERNI, BC, V9Y 8X9"
6929,EQUIS 8,"VANCOUVER ISLAND, CLAYOQUOT DISTRICT, ON NORTH SHORE OF SECHART CHANNEL, 2 MILES E. OF LYALL PT. BARKLEY SOUND",164.0,665,Tseshaht,"5091 TSUMA-AS DR, PORT ALBERNI, BC, V9Y 8X9"
6928,KEITH ISLAND 7,"KEITH ISLAND, BARCLAY DISTRICT, ONE OF A GROUP OF ISLANDS IN BARKLEY DOUND",6.9,665,Tseshaht,"5091 TSUMA-AS DR, PORT ALBERNI, BC, V9Y 8X9"
6930,OMOAH 9,"EFFINGHAM ISLAND, BARCLAY DISTRICT ON SMALL BAY ON EASTERLY SHORE OF ISLAND",12.1,665,Tseshaht,"5091 TSUMA-AS DR, PORT ALBERNI, BC, V9Y 8X9"
6923,TSAHAHEH 1,"VANCOUVER ISLAND, ALBERNI DISTRICT, ON RIGHT BANK OF THE SOMASS RIVER, 3 MILES NORTHWEST OF ALBERNI",328.5,665,Tseshaht,"5091 TSUMA-AS DR, PORT ALBERNI, BC, V9Y 8X9"
6925,TSEOOWA 4,"VANCOUVER ISLAND, CLAYOQUOT DISTRICT, ON EAST SHORE OF RAINY BAY, BARKLEY SOUND",3.2,665,Tseshaht,"5091 TSUMA-AS DR, PORT ALBERNI, BC, V9Y 8X9"
6934,CHENATHA 4,"VANCOUVER ISLAND, CLAYOQUOT DISTRICT, ON NORTHWEST SHORE OF BERKLEY SOUND, 4 MILES EAST OF PORT ALBION",25.1,666,Toquaht,"1971 PENINSULA ROAD, PO BOX 759, UCLUELET, BC, V0R 3A0"
6933,CHEQUIS 3,"VANCOUVER ISLAND, CLAYOQUOT DISTRICT, AT MOUTH OF MAGGIE RIVER, ON MACOAH PASSAGE, BARKLEY SOUND",1.2,666,Toquaht,"1971 PENINSULA ROAD, PO BOX 759, UCLUELET, BC, V0R 3A0"
6932,DEEKYAKUS 2,"VANCOUVER ISLAND, CLAYOQUOT DISTRICT, AT MOUTH OF THE TOQUART RIVER, ON TOQUART BAY",86.6,666,Toquaht,"1971 PENINSULA ROAD, PO BOX 759, UCLUELET, BC, V0R 3A0"
6935,DOOKQUA 5,"VANCOUVER ISLAND, CLAYOQUOT DISTRICT, ON POINT AT ENTRANCE TO UCLUELET ARM OF BARKLEY PASSAGE",7.3,666,Toquaht,"1971 PENINSULA ROAD, PO BOX 759, UCLUELET, BC, V0R 3A0"
6931,MACOAH 1,"VANCOUVER ISLAND, CLAYOQUOT DISTRICT ON MACOAH PASSAGE NORTH BARKLEY SOUND",50.2,666,Toquaht,"1971 PENINSULA ROAD, PO BOX 759, UCLUELET, BC, V0R 3A0"
6937,STUART BAY 6,"CLAYOQUOT DISTRICT, ON BARKLEY SOUND, WEST COAST OF VANCOUVER ISLAND",24.3,666,Toquaht,"1971 PENINSULA ROAD, PO BOX 759, UCLUELET, BC, V0R 3A0"
6938,COWISHIL 1,"VANCOUVER ISLAND, CLAYOQUOT DISTRICT, ON BURROUGH POINT WEST ENTRANCE OF UCHUCKLESIT HARBOUR BARKLEY SOUND",70.8,667,Uchucklesaht,"5251 ARGYLE STREET, SUITE A, PORT ALBERNI, BC, V9Y 1V1"
6939,ELHLATEESE 2,"VANCOUVER ISLAND, CLAYOQUOT DISTRICT, AT HEAD OF UCHUCKLESIT HARBOUR OF BARKLEY SOUND",161.9,667,Uchucklesaht,"5251 ARGYLE STREET, SUITE A, PORT ALBERNI, BC, V9Y 1V1"
6941,CLAKAMUCUS 2,"VANCOUVER ISLAND, CLAYOQUOT DISTRICT, AT HEAD OF UCLUELET INLET OF BARKLEY SOUND",5.7,668,Ucluelet First Nation,"PO BOX 699, UCLUELET, BC, V0R 3A0"
6940,ITTATSOO 1,"VANCOUVER ISLAND, CLAYOQUOT DISTRICT EAST SHORE OF UCLUELET INLET OF BARKLAY SOUND",65.6,668,Ucluelet First Nation,"PO BOX 699, UCLUELET, BC, V0R 3A0"
6944,KLEYKLEYHOUS 5,"VANCOUVER ISLAND, CLAYOQUOT DISTRICT AT MOUTH OF THE NAHMINT RIVER, WEST OF ALBERNI INLET",60.7,668,Ucluelet First Nation,"PO BOX 699, UCLUELET, BC, V0R 3A0"
6947,OO-OOLTH 8,"VANCOUVER ISLAND, CLAYOQUOT DISTRICT ON QUISITIS POINT, WEST HEADLAND OF FLORENCIA BAY",17.0,668,Ucluelet First Nation,"PO BOX 699, UCLUELET, BC, V0R 3A0"
6942,OUTS 3,"VANCOUVER ISLAND, CLAYOQUOT DISTRICT ON THE POINT FORMING WEST ENTRANCE TO EFFINGHAM INLET OF BARKLEY SOUND",4.9,668,Ucluelet First Nation,"PO BOX 699, UCLUELET, BC, V0R 3A0"
6943,QUINAQUILTH 4,"VANCOUVER ISLAND, CLAYOQUOT DISTRICT, AT THE MOUTH OF COEUR D'ALENE CREEK, E. SIDE OF EFFINGHAM INLET",6.0,668,Ucluelet First Nation,"PO BOX 699, UCLUELET, BC, V0R 3A0"
6948,QUISITIS 9,"VANCOUVER ISLAND, CALYOQUOT DISTRICT, AT SOUTHEASTERLY END OF WICKANINNISH BAY",5.0,668,Ucluelet First Nation,"PO BOX 699, UCLUELET, BC, V0R 3A0"
6945,UCLUTH 6,"VANCOUVER ISLAND, CLAYOQUOT DISTRICT, ON SOUTHWESTERLY SIDE OF UCLUTH PENINSULA, 3 MILES N.W. OF UCLEULET",25.3,668,Ucluelet First Nation,"PO BOX 699, UCLUELET, BC, V0R 3A0"
6946,WYA 7,"VANCOUVER ISLAND, CLAYOQUOT DISTRICT, AT WYA POINT, UCLUTH PENINSULA, 3.5 MILES NORTHWEST OF UCLUELET",9.1,668,Ucluelet First Nation,"PO BOX 699, UCLUELET, BC, V0R 3A0"
7669,AIN 6,"QUEEN CHARLOTE DISTRICT, AT MOUTH OF THE AIN RIVER, NORTH SHORE OF MASSET INLET, GRAHAM ISLAND",66.4,669,Old Massett Village Council,"PO BOX 189, OLD MASSET, BC, V0T 1M0"
7683,COHOE POINT 20,"QUEEN CHARLOTTE DIST., LOT 2079, ON DIBRELL BAY, EAST OF LANGARA ISLAND, OFF NORTHWEST TIP OF GRAHAM ISLAND",10.1,669,Old Massett Village Council,"PO BOX 189, OLD MASSET, BC, V0T 1M0"
7675,DANINGAY 12,"QUEEN CHARLOTTE DIST., ON WEST SHORE OF VIRAGO SOUND, NORTH COAST OF GRAHAM ISLAND",8.5,669,Old Massett Village Council,"PO BOX 189, OLD MASSET, BC, V0T 1M0"
7682,EGERIA BAY 19,"QUEEN CHARLOTTE DIST., LOT 2080, ON EGARIA BAY, EAST SHORE OF LANGARA ISLAND, NORTHWEST TIP OF GRAHAM ISLAND",10.1,669,Old Massett Village Council,"PO BOX 189, OLD MASSET, BC, V0T 1M0"
7685,GUOYSKUN 22,"QUEEN CHARLOTTE DISTRICT, LOT 2078, AT RHODE4S POINT, WEST COAST OF LANGARA ISLAND",20.2,669,Old Massett Village Council,"PO BOX 189, OLD MASSET, BC, V0T 1M0"
7665,HIELLEN 2,"QUEEN CHARLOTTE DIST. AT MOUTH OF HIELLEN RIVER E. OF TOW HILL PROVINCIAL PARK, MCINTYRE BAY N. COST OF GRAHAM ISLAND",27.4,669,Old Massett Village Council,"PO BOX 189, OLD MASSET, BC, V0T 1M0"
7677,JALUN 14,QUEEN CHARLOTTE DIST. SOUTHWEST OF NANKIVELL POINT AT MOUTH OF JALUN RIVER NORTH COAST OF GRAHAM ISLAND,7.1,669,Old Massett Village Council,"PO BOX 189, OLD MASSET, BC, V0T 1M0"
7678,KIOOSTA 15,QUEEN CHARLOTTE DISTRICT ON SOUTH SHORE OF PARRY PASSAGE NORTHWEST TIP OF GRAHAM ISLAND,40.9,669,Old Massett Village Council,"PO BOX 189, OLD MASSET, BC, V0T 1M0"
7672,KOSE 9,"QUEEN CHARLOTTE DIST LEFT BANK OF THE NADEN RVR 4 MLS S. OF MOUTH ON NADEN HARBOUR, GRAHAM ISLAND",3.6,669,Old Massett Village Council,"PO BOX 189, OLD MASSET, BC, V0T 1M0"
7674,KUNG 11,"QUEEN CHARLOTTE DISTRICT ON WEST SIDE OF ALEXANDRA NARROWS NODEN HARBOUR VIRAGO SOUND, GRAHAM ISLAND",28.7,669,Old Massett Village Council,"PO BOX 189, OLD MASSET, BC, V0T 1M0"
7667,LANAS 4,QUEEN CHARLOTTE DISTRICT AT MOUTH OF THE YAKOUN RIVER YAKOUN BAY SOUTHEAST SHORE OF MASSET INLET,78.0,669,Old Massett Village Council,"PO BOX 189, OLD MASSET, BC, V0T 1M0"
7688,MAMMIN RIVER 25,"QUEEN CHARLOTTE DISTRICT LOT 2085, AT MOUTH OF THE MAMIN RIVER ON MAMMIN BAY, MASSET INLET, GRAHAM ISLAND",2.5,669,Old Massett Village Council,"PO BOX 189, OLD MASSET, BC, V0T 1M0"
7664,MASSET 1,QUEEN CHARLOEET DIST ON EAST SHORE OF MASSET HARBOUR BELOW ENTRY POINT NORTH COAST OF GRAHAM ISLAND,299.6,669,Old Massett Village Council,"PO BOX 189, OLD MASSET, BC, V0T 1M0"
7671,MEAGWAN 8,QUEEN CHARLOTTE DISTRICT AT WIAH POINT NORTH COAST OF GRAHAM ISLAND EAST OF VIRAGO SOUND,19.8,669,Old Massett Village Council,"PO BOX 189, OLD MASSET, BC, V0T 1M0"
7673,NADEN 10,"QUEEN CHARLOTTE DISTRICT ON WEST SHORE AT MOUTH OF NADEN RIVER, NADEN HARBOUR, GRAHAM ISLAND",10.9,669,Old Massett Village Council,"PO BOX 189, OLD MASSET, BC, V0T 1M0"
7686,NADEN 23,"QUEEN CHARLOTTE DISTRICT LOT 2084, AT MOUTH OF STANDLY CREEK NADEN HARBOUR NORTH SHORE OF GRAHAM ISLAND",2.6,669,Old Massett Village Council,"PO BOX 189, OLD MASSET, BC, V0T 1M0"
7687,OWUN 24,"QUEEN CHARLOTTE DISTRICT, AT THE MOUTH OF THE AWUN RIVER, AWUN BAY, SOUTH SHORE OF MASSET INLET, GRAHAM ISLAND",3.0,669,Old Massett Village Council,"PO BOX 189, OLD MASSET, BC, V0T 1M0"
7681,SAOUCHTEN 18,"QUEEN CHARLOTTE DISTRICT, LOT 174, AT ROONEY POINT, WEST SIDE OF MASSET HARBOUR, GRAHAM ISLAND",11.4,669,Old Massett Village Council,"PO BOX 189, OLD MASSET, BC, V0T 1M0"
7668,SATUNQUIN 5,"QUEEN CHARLOTTE DISTRICT, AT STRATHDANG KWUN, POINT ON WEST SIDE OF YAKOUN BAY OF MASSET INLET, GRAHAM ISLAND",3.6,669,Old Massett Village Council,"PO BOX 189, OLD MASSET, BC, V0T 1M0"
7680,SUSK 17,"QUEEN CHARLOTTE DISTRICT, LOT 2083, AT PERIL BAY, EAST OF FREDERICK ISLAND, WEST SHORE OF GRAHAM ISLAND",63.1,669,Old Massett Village Council,"PO BOX 189, OLD MASSET, BC, V0T 1M0"
7679,TATENSE 16,"QUEEN CHARLOTTE DISTRICT, ON S.W. TIP OF LANGARA ISLAND, N. OF PARRY PASSAGE, N.W. OF GRAHAM ISLAND",6.5,669,Old Massett Village Council,"PO BOX 189, OLD MASSET, BC, V0T 1M0"
7689,TIAHN 27,"QUEEN CHARLOTTE DISTRICT, LOT 2082, AT TIAN BAY, W. SHOTE OF GRAHAM ISLAND",2.3,669,Old Massett Village Council,"PO BOX 189, OLD MASSET, BC, V0T 1M0"
9534,TLAA GAA AAWTLAAS 28,,63.7,669,Old Massett Village Council,"PO BOX 189, OLD MASSET, BC, V0T 1M0"
7666,YAGAN 3,"QUEEN CHARLOTTE DISTRICT, AT YAKAN PT. W. OF TOW HILL PROV. PARK, ON MCINTYRE BAY, SOUTH OF GRAHAM ISLAND",34.8,669,Old Massett Village Council,"PO BOX 189, OLD MASSET, BC, V0T 1M0"
7670,YAN 7,"QUEEN CHARLOTTE DISTRICT, ON WEST SIDE OF ENTRANCE TO MASSET HARBOUR, NORTH COAST OF GRAHAM ISLAND",106.8,669,Old Massett Village Council,"PO BOX 189, OLD MASSET, BC, V0T 1M0"
7684,YASITKUN 21,"QUEEN CHARLOTTE DISTRICT, LOT 2081, ON NORTHWEST COAST OF LANGARA ISLAND, NORTHWEST OF GRAHAM ISLAND",20.2,669,Old Massett Village Council,"PO BOX 189, OLD MASSET, BC, V0T 1M0"
7676,YATZE 13,"QUEEN CHARLOTTE DISTRICT, SOUTHEAST OF KLASHWUN POINT, WEST OF VIRAGOSOUND, NORTH COAST OF GRAHAM ISLAND",18.2,669,Old Massett Village Council,"PO BOX 189, OLD MASSET, BC, V0T 1M0"
7700,BLACK SLATE 11,"QUEEN CHARLOTTE DIST, BLK A, SEC. 23, TP 2, ON SLATECHUCK CREEK ABT 2 MLS WEST OF ITS MOUTH ON KAGAN BAY SKIDGATE INLT",17.7,670,Skidegate,"PO BOX 1301, SKIDEGATE, BC, V0T 1S1"
7696,CUMSHEWAS 7,"QUEEN CHARLOTTE DIST. ON NORTH SHORE OF CUMSHEWAS INLET WEST OF MCCOY COVE, EAST SIDE OF MORESBY ISLAND",22.6,670,Skidegate,"PO BOX 1301, SKIDEGATE, BC, V0T 1S1"
7692,DEENA 3,"QUEEN CHARLOTTE DISTRICT, ON SOUTH SHORE OF SKIDEGATE INLET ON NORTH SIDE OF SOUTH BAY NORTH END OF MORESBY ISLAND",48.2,670,Skidegate,"PO BOX 1301, SKIDEGATE, BC, V0T 1S1"
7695,KASTE 6,"QUEEN CHARLOTTE DISTRICT, AT MOUTH OF COPPER CREEK, ON COPPER BAY, NORTHEAST COAST OF MORESBY ISLAND",15.4,670,Skidegate,"PO BOX 1301, SKIDEGATE, BC, V0T 1S1"
7693,KHRANA 4,"QUEEN CHARLOTTE DISTRICT, ON THE EAST END OF MAUDE ISLAND IN SKIDEGATE INLET BTWN. GRAHAM & MORESBY ISLANDS",85.0,670,Skidegate,"PO BOX 1301, SKIDEGATE, BC, V0T 1S1"
7694,LAGINS 5,"QUEEN CHARLOTTE DISTRICT AT MOUTH OF LAGINS GREEK AT HEAD OF GRAHAM ISLAND, SKIDEGATE INLET",16.2,670,Skidegate,"PO BOX 1301, SKIDEGATE, BC, V0T 1S1"
7699,NEW CLEW 10,"QUEEN CHARLOTTE DISTRICT LOT 175, ON NORTH SHORE OF LOUISE ISLAND IN THE QUEEN CHARLOTE GROUP",11.2,670,Skidegate,"PO BOX 1301, SKIDEGATE, BC, V0T 1S1"
7691,SKAIGHA 2,"QUEEN CHARLOTTE DIST. ON EAST COAST OF GRAHAM ISLAND AT HALIBUT BAY, 7 MILES N. OF SKIDEGATE MISSION",25.1,670,Skidegate,"PO BOX 1301, SKIDEGATE, BC, V0T 1S1"
7697,SKEDANCE 8,"QUEEN CHARLOTTE DISTRICT, ON EAST TIP OF LOUIS ISLAND OF THE QUEEN CHARLOTTE GROUP",68.4,670,Skidegate,"PO BOX 1301, SKIDEGATE, BC, V0T 1S1"
7690,SKIDEGATE 1,"QUEEN CHARLOTTE DIST. AT SKIDEGATE MISSION, MOUTH OF SKIDE- GATE INLET, SOUTHEAST OF GRAHAM ISLAND",505.7,670,Skidegate,"PO BOX 1301, SKIDEGATE, BC, V0T 1S1"
7698,TANOO 9,"QUEEN CHARLOTE DISTRICT, ON THE EAST SHORE OF TANOO ISLAND, QUEEN CHARLOTTE GROUP",26.3,670,Skidegate,"PO BOX 1301, SKIDEGATE, BC, V0T 1S1"
7721,ANYUTAWL 31,"CASSIAR DISTRICT, LOT 1095, ON RIGHT BANK OF THE NASS RIVER 5 MILES NORTHEAST OF MOUTH OF ANUDOL CREEK",2.0,671,Nisga'a Village of Gingolx,"607 FRONT ST, GINGOLX, BC, V0V 1B0"
7702,BLACK POINT 11,"COAST DIST. RGE 5, AT BLACK PT. ON RIGHT BANK OF THE NASS RIVER, ABOUT 14 MILES ABOVE MOUTH OF PORTLAND INLET",16.4,671,Nisga'a Village of Gingolx,"607 FRONT ST, GINGOLX, BC, V0V 1B0"
7720,DACHLABAH 30,"CASSIAR DISTRICT, ON RIGHT BANK OF THENASS RIVER, 2 MILES SOUTHWEST OF MOUTH OF ANDUDOL CREEK",61.1,671,Nisga'a Village of Gingolx,"607 FRONT ST, GINGOLX, BC, V0V 1B0"
7732,DOGFISH BAY 42,"CASSIAR DISTRICT, LOTS 628A AND 5432, ON EAST SHORE OF THE PORTLAND CANAL, NORTH OF THE DOGFISH BIGHT",382.4,671,Nisga'a Village of Gingolx,"607 FRONT ST, GINGOLX, BC, V0V 1B0"
7709,GEORGIE 17,"CASSIAR DISTRICT, ON EAST SHORE OF THE PORTLAND CANAL AT MOUTH OF THE GEORGIE RIVER, NEAR BLUE POINT",28.7,678,Nisga'a Village of Laxgalt'sap,"PO BOX 200, 416 NORTH RD, GREENVILLE, BC, V0J 1X0"
8376,GITZAULT 24,58 KM SOUTHEAST OF STEWART,61.6,671,Nisga'a Village of Gingolx,"607 FRONT ST, GINGOLX, BC, V0V 1B0"
7722,IGHTKEANY 32,"CASSIAR DISTRIC LOT 5435, 1/2 MILE EAST OF THE NASS RIVER ON THE GINLULAK CREEK",202.3,671,Nisga'a Village of Gingolx,"607 FRONT ST, GINGOLX, BC, V0V 1B0"
7723,ISHKSEENICKH 33,"COAST DISTRICT, RANGE 5, LOT 6924, RIGHT BANK OF THE ISHKHEENICKH RIVER 1/2 MLE EAST OF MOUTH ON THE NASS RIVER",2.6,671,Nisga'a Village of Gingolx,"607 FRONT ST, GINGOLX, BC, V0V 1B0"
7724,ISHKSEENICKH RIVER 34,"COAST DISTRICT, RANGE 5, LOT 6925, LEFT BANK OF THE IHKSEENICKH RIVER 2 1/2 MLS ABOVE MOUTH ON NASS RIVER",2.0,671,Nisga'a Village of Gingolx,"607 FRONT ST, GINGOLX, BC, V0V 1B0"
7725,ISHKSEENICKH RIVER 35,"COAST DISTRICT, RANGE 5, LOT 6450 ON LEFT BANK OF THE ISHKSEENICKH RIVER, 5 MILES SOSUTH OF MOUTH ON NASS RIVER",2.0,671,Nisga'a Village of Gingolx,"607 FRONT ST, GINGOLX, BC, V0V 1B0"
7726,ISHKSEENICKH RIVER 36,"COAST DISTRICT, RANGE 5, LOT 6451 ON THE ISHKSEENICKH RIVER 7 MILES SOUTH OF MOUTH ON NASS RIVER",2.3,671,Nisga'a Village of Gingolx,"607 FRONT ST, GINGOLX, BC, V0V 1B0"
7727,ISHKSEENICKH RIVER 37,"COAST DISTRICT, RANGE 5, LOT 6452, ON LEFT BANK OF THE ISHKSEENICKH RIVER 9 MILES SOUTH OF MOUTH ON NASS RIVER",2.1,671,Nisga'a Village of Gingolx,"607 FRONT ST, GINGOLX, BC, V0V 1B0"
7705,KINCOLITH 14,"COAST DISTRICT RANGE 5, ON RIGHT BANK OF THE NASS RIVER AT MOUTH ON PORTLAND INLET",477.5,671,Nisga'a Village of Gingolx,"607 FRONT ST, GINGOLX, BC, V0V 1B0"
7706,KINCOLITH 14A,"COAST DIST. RGE 5, AN ADD. TO I.R. NO 14 FRONTING ON THE RIGHT BANK OF THE NASS RIVER AT MOUTH ON PORTLAND INLET",156.9,671,Nisga'a Village of Gingolx,"607 FRONT ST, GINGOLX, BC, V0V 1B0"
7711,KINMELIT 20,"CASSIAR DISTRICT ON SAAMON COVE, WEST OF OF OBSERVATORY INLET",19.6,671,Nisga'a Village of Gingolx,"607 FRONT ST, GINGOLX, BC, V0V 1B0"
7707,KINNAMAX 15,"COAST DISTRICT RANGE 5, NEAR MOUTH OF THE KWINAMASS RIVER ON KWINAMASS BAY, PORTLAND INLET",1.6,671,Nisga'a Village of Gingolx,"607 FRONT ST, GINGOLX, BC, V0V 1B0"
7717,KSHWAN 27,"CASSIAR DISTRICT, ON RIGHT BANK OF THE KSHWAN RIVER AT ITS MOUTH AT HEAD OF HASTINGS ARM OF OBSERVATORY INLET",54.0,671,Nisga'a Village of Gingolx,"607 FRONT ST, GINGOLX, BC, V0V 1B0"
7718,KSHWAN 27A,CASSIAR DISTRICT AT THE MOUTH OF THE KSHWAN RIVER AT HEAD OF HASTINGS ARM OF OBSERVATORY INLET,56.7,671,Nisga'a Village of Gingolx,"607 FRONT ST, GINGOLX, BC, V0V 1B0"
7714,KTSINET 23,"CASSIAR DISTRICT ON PERRY BAY, EAST SHORE OF OBSERVATORY INLET",109.7,671,Nisga'a Village of Gingolx,"607 FRONT ST, GINGOLX, BC, V0V 1B0"
7703,LACHTESK 12,"COAST DISTRICT RANGE 5 ON SOUTH SHORE OF NASS BAY, 9 MILES NORTHEASTERLY FROM NASS HARBOUR, PORTLAND INLET",121.0,678,Nisga'a Village of Laxgalt'sap,"PO BOX 200, 416 NORTH RD, GREENVILLE, BC, V0J 1X0"
8356,LACHTESK 12A,"COAST DISTRICT RANGE 5, ON SOUTH SHORE OF NASS BAY 10 MILES NORTHEASTERLY FROM NASS HARBOUR PORTLANT INLET",91.5,671,Nisga'a Village of Gingolx,"607 FRONT ST, GINGOLX, BC, V0V 1B0"
7731,LAKATA 41,"COAST DISTRICT RANGE 5, LOT 3964, ON LEFT BANK OF THE NASS RIVER, 13 MILES FROM PORTLAND INLET",119.8,671,Nisga'a Village of Gingolx,"607 FRONT ST, GINGOLX, BC, V0V 1B0"
7728,LAKBELAK 38,"COAST DISTRICT RANGE 5, LOT 6453, WEST OF LACHBALLACH CREEK NEAR MOUTH OF THE ISHKHEENICKH RIVER AT TRIB. OF NASS RIVER",2.0,671,Nisga'a Village of Gingolx,"607 FRONT ST, GINGOLX, BC, V0V 1B0"
7729,LAKBELAK CREEK 39,"COAST DIST. RGE5, LOT 6455 LEFT BANK OF LACHBALLACH CREEK 3 MLS ABOVE JUNCTION WITH ISHKHEENICKH RVR A TRIB. OF NASS RVR",2.0,671,Nisga'a Village of Gingolx,"607 FRONT ST, GINGOLX, BC, V0V 1B0"
7730,LAKBELAK LAKE 40,"COAST DIST R5,LT6454 S. SHORE OF LACHBALLACH LK AT HEAD OF LACHBALLALCH CR FLOWING INTO ISHKHEENICKH RVR TRIB OF NASS",2.2,678,Nisga'a Village of Laxgalt'sap,"PO BOX 200, 416 NORTH RD, GREENVILLE, BC, V0J 1X0"
7733,PEARSE ISLAND 43,"CASSIAR DISTRICT LOT 5431, NORTH END OF PEARSE ISLAND FRONTING ON THE PORTLAND CANAL",67.2,671,Nisga'a Village of Gingolx,"607 FRONT ST, GINGOLX, BC, V0V 1B0"
7704,RED CLIFF (RED BLUFF) 13,"COAST DISTRICT, RGE 5, ON RIGHT BANK OF THE NASS RIVER, ABOUT 9 MILES EAST OF MOUTH ON PORTLAND INLET",313.1,671,Nisga'a Village of Gingolx,"607 FRONT ST, GINGOLX, BC, V0V 1B0"
7710,SCAMAKOUNST 19,"CASSIAR DISTRICT, AT THE MOUTH OF THE BEAR RIVER, ON EAST SHORE AT HEAD OF PORTLAND CANAL",23.7,671,Nisga'a Village of Gingolx,"607 FRONT ST, GINGOLX, BC, V0V 1B0"
7719,SCOWBAN 28,"CASSIAR DISTRICT, ON EAST SHORE OF OBSERVATORY INLET, , 4 MILES NORTH OF NASS POINT",31.8,671,Nisga'a Village of Gingolx,"607 FRONT ST, GINGOLX, BC, V0V 1B0"
7712,SLOOKS 21,"CASSIAR DISTRICT, AT DAWKINS POINT, EAST SIDE OF OBSERVATORY INLET",6.9,678,Nisga'a Village of Laxgalt'sap,"PO BOX 200, 416 NORTH RD, GREENVILLE, BC, V0J 1X0"
7713,STAQOO 22,"CASSIAR DISTRICT, ON EAST SHORE OF OBSERVATORY INLET, AT MOUTH OF STAGOO CREEK, OPPOSITE RICHARDS POINT",19.2,671,Nisga'a Village of Gingolx,"607 FRONT ST, GINGOLX, BC, V0V 1B0"
7701,STONY POINT (FISHERY BAY) 10,"CASSIAR DISTRICT, ON RIGHT BANK OF NASS RIVER AT STONY PT. ABOUT 15 MILES NORTHEAST OF RIVER MOUTH ON PORTLAND INLET",144.7,671,Nisga'a Village of Gingolx,"607 FRONT ST, GINGOLX, BC, V0V 1B0"
7715,TACKUAN 26,"CASSIAR DISTRICT, ON WEST SHORE OF HASTINGS ARM OF OBSER- VATORY INLET, AT NORTH END OF LARCOM ISLAND",202.5,671,Nisga'a Village of Gingolx,"607 FRONT ST, GINGOLX, BC, V0V 1B0"
7716,TACKUAN 26A,"CASSIAR DISTRICT, LOT 5433, WEST OF AND ADJOINING I.R. 26, 2 MILES WEST OF NORTH END OF LARCOM ISLAND, OBSERVATORY INLT",37.1,671,Nisga'a Village of Gingolx,"607 FRONT ST, GINGOLX, BC, V0V 1B0"
7708,TALAHAAT 16,"COAST DISTRICT, RANGE 5, ON THE KWINAMISS RIVER, 3 MILRS EAST OF MOUTH OF KWINAMISS BAY, OFF PORTLAND INLET",64.8,671,Nisga'a Village of Gingolx,"607 FRONT ST, GINGOLX, BC, V0V 1B0"
7742,CITEYATS 9,"COAST DISTRICT, RGE. 4, ON SHORE AT SOUTH END OF PITT ISLAND NORTH OF MCCREIGHT POINT",14.8,672,Gitxaala Nation,"PO BOX 149, KITKATLA, BC, V0V 1C0"
7746,CLOWEL 13,"COAST DIST. RGE 4, ON WEST SHORE OF PITT ISLAND, AT EN- TRANCE TO PATTERSON INLET FROM PRINCIPLE CHANNEL",6.1,672,Gitxaala Nation,"PO BOX 149, KITKATLA, BC, V0V 1C0"
7734,DOLPHIN ISLAND 1,"COAST DISTRICT, RANGE 4, AND ISLAND IN BROWNING ENTRANCE OF HECATE STRAIT",1557.3,672,Gitxaala Nation,"PO BOX 149, KITKATLA, BC, V0V 1C0"
7735,GRASSY ISLET 2,"COAST DISTRICT, RANGE 4, A SMALL ISLAND N.E. OF DOLPHIN ISLAND IN ENTRANCE TO OGDEN CHANNEL OFF HECATE STRAIT",0.4,672,Gitxaala Nation,"PO BOX 149, KITKATLA, BC, V0V 1C0"
7744,KEECHA 11,"COAST DISTRICT, RANGE 4, ON EAST SHORE OF BANKS ISLAND AT KEECHA POINT ON PRINCIPE CHANNEL",1.6,672,Gitxaala Nation,"PO BOX 149, KITKATLA, BC, V0V 1C0"
7749,KESWAR 16,"COAST DISTRICT, RANGE 4, ON THE WEST COAST OF MCCAULEY ISLAND FRONTING ON BROWNING ENTRANCE TO PRINCIPE CHANNEL",8.5,672,Gitxaala Nation,"PO BOX 149, KITKATLA, BC, V0V 1C0"
7750,KEYARKA 17,"COAST DISTRICT RANGE 4, ON THE EAST COAST OF BANKS ISLAND 6 MILES FROM NORTH END FRONTING ON PRINCIPE CHANNEL",5.0,672,Gitxaala Nation,"PO BOX 149, KITKATLA, BC, V0V 1C0"
7743,KITLAWAOO 10,"COAST DISTRICT RANGE 4, ON EAST SHORE OF BANKS ISLAND SIX MILES FROM SOUTH END FRONTING ON PRINCIPE CHANNEL",2.4,672,Gitxaala Nation,"PO BOX 149, KITKATLA, BC, V0V 1C0"
7752,KITSEMENLAGAN 19,"COAST DISTRICT RANGE 4, LOT 2585 ON WEST SHORE OF PITT ISLAND AT CURTIS INLET OFF ALA PASSAGE E. OF ANGER ISLAND",2.0,672,Gitxaala Nation,"PO BOX 149, KITKATLA, BC, V0V 1C0"
7753,KITSEMENLAGAN 19A,"COAST DISTRICT RANGE 4, LOT 2585A, ON WEST SHORE OF PITT ISLAND AT CURTIS INLET OFF ALA PASSAGE",5.4,672,Gitxaala Nation,"PO BOX 149, KITKATLA, BC, V0V 1C0"
7737,KLAPTHLON 5,"COAST DISTRICT RANGE 4, ON NORTHEAST COAST OF PITT ISLAND FRONTING ON GRENVILLE CHANNEL, S. OF GIBSON ISLAND",45.3,672,Gitxaala Nation,"PO BOX 149, KITKATLA, BC, V0V 1C0"
7738,KLAPTHLON 5A,"COAST DISTRICT RANGE 4, ON NORTHEAST COAST OF PITT ISLAND FRONTING ON GRENVILLE CHANNEL, WEST OF I.R. NO. 5",51.0,672,Gitxaala Nation,"PO BOX 149, KITKATLA, BC, V0V 1C0"
7745,KOORYET 12,"COAST DISTRICT RANGE 4, ON EAST SHORE OF BANKS ISLAND FRONT- ING ON PRINCIPE CHANNEL WEST OF LITTLEJOHN POINT, PITT ISL.",5.5,672,Gitxaala Nation,"PO BOX 149, KITKATLA, BC, V0V 1C0"
7751,KUL 18,"COAST DISTRICT RANGE 4, ON WEST SHORE OF BONILLA ISLAND IN HECATE STRAIT 8 MILES WEST OF BANKS ISLAND",38.4,672,Gitxaala Nation,"PO BOX 149, KITKATLA, BC, V0V 1C0"
8357,KUMOWDAH 3,"COAST DISTRICT RANGE 4, ON THE STREAM BETWEEN LOWE INLET AND LOWE LAKE EAST SHORE OF GRENVILLE CHANNEL",74.5,672,Gitxaala Nation,"PO BOX 149, KITKATLA, BC, V0V 1C0"
7739,PA-AAT 6,"COAST DISTRICT, RANGE 4, ON EAST SHORE OF PITT ISLAND, AT MOUTH OF SALMON INLET, GRENVILLE CHANNEL",6.0,672,Gitxaala Nation,"PO BOX 149, KITKATLA, BC, V0V 1C0"
7736,SAND ISLAND 4,"COAST DISTRICT, RANGE 4, AN ISLAND NORTH OF DOLPHIN ISLAND (I.R. NO. 1) OFF HECATE STRAIT",2.0,672,Gitxaala Nation,"PO BOX 149, KITKATLA, BC, V0V 1C0"
7747,SHEGANNY 14,"COAST DISTRICT, RANGE 4, ON WEST COAST OF PITT ISLAND AT HEAD OF PATTERSON INLET, OFF PRINCIPE CHANNEL",11.0,672,Gitxaala Nation,"PO BOX 149, KITKATLA, BC, V0V 1C0"
7741,TOOWARTZ 8,"COAST DISTRICT, RANGE 4, ON SOUTH SHORE OF PITT ISLAND, AT HEAD OF TUWARTZ INLET, WEST OF FIN ISLAND",21.0,672,Gitxaala Nation,"PO BOX 149, KITKATLA, BC, V0V 1C0"
7748,TSIMLAIREN 15,"COAST DISTRICT, RGE 4, ON WEST COAST OF PITT ISLAND, ON THE SOUTH SHORE OF CURTIS INLET, OFF PRINCIPE CHANNEL",16.0,672,Gitxaala Nation,"PO BOX 149, KITKATLA, BC, V0V 1C0"
7740,TSIMTACK 7,"COAST DISTRICT, RGE 4, ON SOSUTHEAST PART OF PITT ISLAND FRONTING ON UNION PASSAGE, NORTH OF FARRANT ISLAND",11.0,672,Gitxaala Nation,"PO BOX 149, KITKATLA, BC, V0V 1C0"
7768,AVERY ISLAND 92,"COAST DISTRICT , RG. 5, LOT 3917, ENTIRE AVERY ISLAND, NORTH OF STEPHENS ISLAND IN BELL PASSAGE",20.4,673,Metlakatla First Nation,"PO BOX 459, PRINCE RUPERT, BC, V8J 3R2"
7761,DASHKEN 22,"COAST DISTRICT, RANGE 5, ON EAST SHORE OF SMITH ISLAND AT MOUTH OF THE SKEENA RIVER",3.0,674,Lax Kw'alaams,"206 SHASHAAK STREET, LAX KW'ALAAMS, BC, V0V 1H0"
7769,EDYE 93,"COAST DISTRICT, RGE 5, LOT 3916, ALL OF A SMALL ISLAND IN EDYE PASSAGE, SOUTH OF PRESCOTT ISLAND",0.4,673,Metlakatla First Nation,"PO BOX 459, PRINCE RUPERT, BC, V8J 3R2"
10023,GRASSY BAY,ALL OF PARCEL A OF DISTRICT LOT 251 AS SHOWN ON PLAN EPP 16565 DEPOSITED IN THE LAND TITLE OFFICE IN NEW WESTMINSTER B.C,8.3,673,Metlakatla First Nation,"PO BOX 459, PRINCE RUPERT, BC, V8J 3R2"
7758,KHTAHDA 10,"COAST DISTRICT RANGE 5, ON LEFT BANK OF THE SKEENA RIVER AT MOUTH OF THE KHTADA RIVER",1.4,673,Metlakatla First Nation,"PO BOX 459, PRINCE RUPERT, BC, V8J 3R2"
7757,KHYEX 8,"COAST DISTRICT RANGE 5, ON RIGHT BANK OF THE SKEENA RIVER AT MOUTH OF KHYEX RIVER",17.5,674,Lax Kw'alaams,"206 SHASHAAK STREET, LAX KW'ALAAMS, BC, V0V 1H0"
7762,KSHAOOM 23,"COAST DISTRICT RANGE 5, AT NORTH END OF DE HORSEY ISLAND AT MOUTH OF THE SKEENA RIVER",2.6,673,Metlakatla First Nation,"PO BOX 459, PRINCE RUPERT, BC, V8J 3R2"
7764,LAKELSE 25,"COAST DISTRICT RANGE 5, ON RIGHT BANK OF THE LAKELSE RIVER 1 MILE NORTHWEST OF LAKELSE LAKE",8.5,674,Lax Kw'alaams,"206 SHASHAAK STREET, LAX KW'ALAAMS, BC, V0V 1H0"
7763,MEANLAW 24,"COAST DISTRICT RANGE 5, ON RIGHT BANK OF THE SKEENA RIVER 2 MILES NORTH OF VEITCH POINT",2.7,673,Metlakatla First Nation,"PO BOX 459, PRINCE RUPERT, BC, V8J 3R2"
10025,POINT VEITCH 7,RANGE 5 COAST DISTRICT,6.2,674,Lax Kw'alaams,"206 SHASHAAK STREET, LAX KW'ALAAMS, BC, V0V 1H0"
7841,RED BLUFF 88,"COAST DISTRICT, RGE 5, LOT 3965, ON NORTH SIDE OF NASS BAY, AT MOUTH OF THE NASS RIVER",135.5,673,Metlakatla First Nation,"PO BOX 459, PRINCE RUPERT, BC, V8J 3R2"
7766,RUSHTON ISLAND 90,"COAST DIST RGE 5, LOT 3915, ENTIRE RUSHTON ISLAND & 1 SMALL ISLAND TO N., IN BROWN PASS. ENTRANGE TO CHATHAM SOUND",6.8,674,Lax Kw'alaams,"206 SHASHAAK STREET, LAX KW'ALAAMS, BC, V0V 1H0"
7754,S1/2 TSIMPSEAN 2,"COAST DISTRICT, RANGE 5, ON W COAST OF TSIMPSEAN PENINSULA AND NORTH END OF DIGBY ISLAND, ON E SHORE OF CHATHAM SOUND",3270.0,673,Metlakatla First Nation,"PO BOX 459, PRINCE RUPERT, BC, V8J 3R2"
7759,SCUTTSAP 11,"COAST DISTRICT, RANGE 5, ON LEFT BANK OF THE SKEENA RIVER, 1 MILE SOUTHWEST OF KWINITSA C.N. STATION",1.5,674,Lax Kw'alaams,"206 SHASHAAK STREET, LAX KW'ALAAMS, BC, V0V 1H0"
7756,SHOOWAHTLANS (SHAWTLANS) 4,"COAST DIS. RGE 5, WEST END OF SHAWATTAN LAKE, NORTH END OF MORSE BASIN, 2 MILES NORTHEAST OF PRINCE RUPERT",0.5,673,Metlakatla First Nation,"PO BOX 459, PRINCE RUPERT, BC, V8J 3R2"
7767,SQUADEREE 91,"COAST DISTRICT, RANGE 5, LOT 3914, ON POINT ON SOUTHWEST COAST OF STEPHENS ISLAND, N. ENTRANCE TO HECATE STRAIT",2.2,674,Lax Kw'alaams,"206 SHASHAAK STREET, LAX KW'ALAAMS, BC, V0V 1H0"
10024,TSIMPSEAN 2A,RANGE 5 COAST DISTRICT,4114.0,673,Metlakatla First Nation,"PO BOX 459, PRINCE RUPERT, BC, V8J 3R2"
7765,TUCK INLET 89,"COAST DISTRICT, RANGE 5, LOT 3950, AT HEAD OF TUCK INLET, 10 MILES NORTH OF PRINCE RUPERT",1.6,674,Lax Kw'alaams,"206 SHASHAAK STREET, LAX KW'ALAAMS, BC, V0V 1H0"
7760,TUGWELL ISLAND 21,"COAST DISTRICT, ENTIRE TUGWELL ISLAND, ENTRANCE TO VENN PASS, 8 MILES WEST OF PRINCE RUPERT",126.2,673,Metlakatla First Nation,"PO BOX 459, PRINCE RUPERT, BC, V8J 3R2"
10026,WILLACLOUGH 6,RANGE 5 COAST DISTRICT,10.2,673,Metlakatla First Nation,"PO BOX 459, PRINCE RUPERT, BC, V8J 3R2"
